experiment	cv_score	mean	std	min_fold	test_score	status	description
exp198	4.226349	4.616631	0.780565	3.878618	NA	kept	downsize hot stalled BTC trend entries to half percent
exp199	4.227539	4.617692	0.780305	3.878618	NA	kept	downsize DOT mild reversion entries to quarter percent
exp200	4.227623	4.618207	0.781168	3.878618	NA	kept	downsize hot stalled BTC trend entries to quarter percent
exp201	4.228216	4.618736	0.781040	3.878618	NA	kept	downsize DOT mild reversion entries to eighth percent
exp202	4.228511	4.619000	0.780976	3.878618	NA	kept	downsize DOT mild reversion entries to sixteenth percent
exp203	4.228659	4.619131	0.780944	3.878618	NA	kept	downsize DOT mild reversion entries to thirty-second percent
exp204	4.228733	4.619197	0.780929	3.878618	3.985036	kept	downsize DOT mild reversion entries to sixty-fourth percent
exp205	4.123883	4.550076	0.852386	3.602134	NA	reverted	verify run_experiment.py
exp206	4.123883	4.550076	0.852386	3.602134	NA	revert	integration test: verify script
